id,severity,title,description,iacontrols,ruleID,fixid,fixtext,checkid,checktext
V-219194,medium,The Ubuntu operating system must configure /var/log/syslog file with mode 0640 or less permissive.,"Only authorized personnel should be aware of errors and the details of the errors. Error messages are an indicator of an organization's operational state or can identify the operating system or platform. Additionally, Personally Identifiable Information (PII) and operational information must not be revealed through error messages to unauthorized personnel or their designated representatives.

The structure and content of error messages must be carefully considered by the organization and development team. The extent to which the information system is able to identify and handle error conditions is guided by organizational policy and operational requirements.",None,SV-219194r610963_rule,F-20918r304911_fix,"Configure the Ubuntu operating system to have permissions of 0640 o for the /var/log/syslog file by running the following command:

# sudo chmod 0640 /var/log/syslog",C-20919r304910_chk,"Verify that the Ubuntu operating system configures the /var/log/syslog file with mode 0640 or less permissive.

Check the /var/log/syslog permissions by running the following command:

# stat -c ""%n %a"" /var/log/syslog

/var/log/syslog 640

If a value of ""640"" or less permissive is not returned, this is a finding."
V-219197,medium,The Ubuntu operating system must configure the audit tools to be group-owned by root.,"Protecting audit information also includes identifying and protecting the tools used to view and manipulate log data. Therefore, protecting audit tools is necessary to prevent unauthorized operation on audit information.

The Ubuntu operating system providing tools to interface with audit information will leverage user permissions and roles identifying the user accessing the tools and the corresponding rights the user enjoys in order to make access decisions regarding the access to audit tools.

Audit tools include, but are not limited to, vendor-provided and open source audit tools needed to successfully view and manipulate audit information system activity and records. Audit tools include custom queries and report generators.",None,SV-219197r610963_rule,F-20921r304920_fix,"Configure the audit tools on the Ubuntu operating system to be group-owned by root, by running the following command:

# sudo chgrp root [audit_tool]

Replace ""[audit_tool]"" with each audit tool not group-owned by root.",C-20922r304919_chk,"Verify the Ubuntu operating system configures the audit tools to be group-owned by root to prevent any unauthorized access, deletion, or modification.

For each audit tools, 
/sbin/auditctl, /sbin/aureport, /sbin/ausearch, /sbin/autrace, /sbin/auditd, /sbin/audispd, /sbin/augenrules 

Check the group-owner of each audit tool by running the following commands:

stat -c ""%n %G"" /sbin/auditctl

/sbin/auditctl root

If any of the audit tools are not group-owned by root, this is a finding."
V-219196,medium,The Ubuntu operating system must configure audit tools to be owned by root.,"Protecting audit information also includes identifying and protecting the tools used to view and manipulate log data. Therefore, protecting audit tools is necessary to prevent unauthorized operation on audit information.

The Ubuntu operating system providing tools to interface with audit information will leverage user permissions and roles identifying the user accessing the tools and the corresponding rights the user enjoys in order to make access decisions regarding the access to audit tools.

Audit tools include, but are not limited to, vendor-provided and open source audit tools needed to successfully view and manipulate audit information system activity and records. Audit tools include custom queries and report generators.",None,SV-219196r610963_rule,F-20920r304917_fix,"Configure the audit tools on the Ubuntu operating system to be owned by root, by running the following command:

# sudo chown root [audit_tool]

Replace ""[audit_tool]"" with each audit tool not owned by root.",C-20921r304916_chk,"Verify the Ubuntu operating system configures the audit tools to be owned by root to prevent any unauthorized access, deletion, or modification.

For each audit tool, 
/sbin/auditctl, /sbin/aureport, /sbin/ausearch, /sbin/autrace, /sbin/auditd, /sbin/audispd, /sbin/augenrules 

Check the ownership by running the following command:

# stat -c ""%n %U"" /sbin/auditctl

/sbin/auditctl root

If any of the audit tools are not owned by root, this is a finding."
V-219229,medium,The Ubuntu operating system must permit only authorized accounts ownership of the audit log files.,"If audit information were to become compromised, then forensic analysis and discovery of the true source of potentially malicious system activity is impossible to achieve.

To ensure the veracity of audit information, the operating system must protect audit information from unauthorized modification.

Audit information includes all information (e.g., audit records, audit settings, audit reports) needed to successfully audit information system activity.

Satisfies: SRG-OS-000058-GPOS-00028, SRG-OS-000057-GPOS-00027",None,SV-219229r610963_rule,F-20953r305016_fix,"Configure the audit log files to be owned by ""root"" user.

First determine where the audit logs are stored with the following command:

# sudo grep -iw log_file /etc/audit/auditd.conf
log_file = /var/log/audit/audit.log

Using the path of the directory containing the audit logs, configure the audit log files to be owned by ""root"" user by using the following command:

# sudo chown root /var/log/audit/*",C-20954r305015_chk,"Verify that the audit log files are owned by ""root"" account.

First determine where the audit logs are stored with the following command:

# sudo grep -iw log_file /etc/audit/auditd.conf
log_file = /var/log/audit/audit.log

Using the path of the directory containing the audit logs, check if the audit log files are owned by the ""root"" user by using the following command:

# sudo stat -c ""%n %U"" /var/log/audit/*
/var/log/audit/audit.log root

If the audit log files are owned by an user other than ""root"", this is a finding."
V-219228,medium,The Ubuntu operating system must be configured so that audit log files cannot be read or write-accessible by unauthorized users.,"If audit information were to become compromised, then forensic analysis and discovery of the true source of potentially malicious system activity is impossible to achieve.

To ensure the veracity of audit information, the operating system must protect audit information from unauthorized modification.

Audit information includes all information (e.g., audit records, audit settings, audit reports) needed to successfully audit information system activity.

Satisfies: SRG-OS-000058-GPOS-00028, SRG-OS-000057-GPOS-00027",None,SV-219228r610963_rule,F-20952r305013_fix,"Configure the audit log files to have a mode of ""0600"" or less permissive.

First determine where the audit logs are stored with the following command:

# sudo grep -iw log_file /etc/audit/auditd.conf
log_file = /var/log/audit/audit.log

Using the path of the directory containing the audit logs, configure the audit log files to have a mode of ""0600"" or less permissive by using the following command:

# sudo chmod 0600 /var/log/audit/*",C-20953r305012_chk,"Verify that the audit log files have a mode of ""0600"" or less permissive.

First determine where the audit logs are stored with the following command:

# sudo grep -iw log_file /etc/audit/auditd.conf
log_file = /var/log/audit/audit.log

Using the path of the directory containing the audit logs, check if the audit log files have a mode of ""0600"" or less by using the following command:

# sudo stat -c ""%n %a"" /var/log/audit/*
/var/log/audit/audit.log 600

If the audit log files have a mode more permissive than ""0600"", this is a finding."
V-219227,medium,The Ubuntu operating system must shut down by default upon audit failure (unless availability is an overriding concern).,"It is critical that when the Ubuntu operating system is at risk of failing to process audit logs as required, it takes action to mitigate the failure. Audit processing failures include: software/hardware errors; failures in the audit capturing mechanisms; and audit storage capacity being reached or exceeded. Responses to audit failure depend upon the nature of the failure mode.

When availability is an overriding concern, other approved actions in response to an audit failure are as follows: 

1) If the failure was caused by the lack of audit record storage capacity, the Ubuntu operating system must continue generating audit records if possible (automatically restarting the audit service if necessary), overwriting the oldest audit records in a first-in-first-out manner.

2) If audit records are sent to a centralized collection server and communication with this server is lost or the server fails, the Ubuntu operating system must queue audit records locally until communication is restored or until the audit records are retrieved manually. Upon restoration of the connection to the centralized collection server, action should be taken to synchronize the local audit data with the collection server.",None,SV-219227r610963_rule,F-20951r305010_fix,"Configure the Ubuntu operating system to shut down by default upon audit failure (unless availability is an overriding concern).

Add or update the following line (depending on configuration ""disk_full_action"" can be set to ""SYSLOG"", ""HALT"" or ""SINGLE"") in ""/etc/audit/auditd.conf"" file:

disk_full_action = HALT

Restart the auditd service so the changes take effect:
# sudo systemctl restart auditd.service",C-20952r305009_chk,"Verify the Ubuntu operating system takes the appropriate action when the audit storage volume is full. 

Check that the Ubuntu operating system takes the appropriate action when the audit storage volume is full with the following command:

# sudo grep disk_full_action /etc/audit/auditd.conf

disk_full_action = HALT

If the value of the ""disk_full_action"" option is not ""SYSLOG"", ""SINGLE"", or ""HALT"", or the line is commented out, this is a finding."
V-219226,medium,The Ubuntu operating system must alert the ISSO and SA (at a minimum) in the event of an audit processing failure.,"It is critical for the appropriate personnel to be aware if a system is at risk of failing to process audit logs as required. Without this notification, the security personnel may be unaware of an impending failure of the audit capability, and system operation may be adversely affected.

Audit processing failures include software/hardware errors, failures in the audit capturing mechanisms, and audit storage capacity being reached or exceeded.

This requirement applies to each audit data storage repository (i.e., distinct information system component where audit records are stored), the centralized audit storage capacity of organizations (i.e., all audit data storage repositories combined), or both.",None,SV-219226r610963_rule,F-20950r305007_fix,"Configure ""auditd"" service to notify the System Administrator (SA) and Information System Security Officer (ISSO) in the event of an audit processing failure. 

Edit the following line in ""/etc/audit/auditd.conf"" to ensure that administrators are notified via email for those situations:

action_mail_acct = root

Restart the auditd service so the changes take effect:
# sudo systemctl restart auditd.service",C-20951r305006_chk,"Verify that the System Administrator (SA) and Information System Security Officer (ISSO) (at a minimum) are notified in the event of an audit processing failure.

Check that the Ubuntu operating system notifies the SA and ISSO (at a minimum) win the event of an audit processing failure with the following command:

# sudo grep action_mail_acct = root /etc/audit/auditd.conf

action_mail_acct = root

If the value of the ""action_mail_acct"" keyword is not set to ""root"" and/or other accounts for security personnel, the ""action_mail_acct"" keyword is missing, or the returned line is commented out, this is a finding."
V-219225,medium,"The Ubuntu operating system must produce audit records and reports containing information to establish when, where, what type, the source, and the outcome for all DoD-defined auditable events and actions in near real time.","Without establishing the when, where, type, source, and outcome of events that occurred, it would be difficult to establish, correlate, and investigate the events leading up to an outage or attack.

Without the capability to generate audit records, it would be difficult to establish, correlate, and investigate the events relating to an incident or identify those responsible for one.

Audit record content that may be necessary to satisfy this requirement includes, for example, time stamps, source and destination addresses, user/process identifiers, event descriptions, success/fail indications, filenames involved, and access control or flow control rules invoked.

Reconstruction of harmful events or forensic analysis is not possible if audit records do not contain enough information.

Successful incident response and auditing relies on timely, accurate system information and analysis in order to allow the organization to identify and respond to potential incidents in a proficient manner. If the operating system does not provide the ability to centrally review the operating system logs, forensic analysis is negatively impacted.

Associating event types with detected events in the Ubuntu operating system audit logs provides a means of investigating an attack; recognizing resource utilization or capacity thresholds; or identifying an improperly configured operating system.

Satisfies: SRG-OS-000038-GPOS-00016, SRG-OS-000039-GPOS-00017, SRG-OS-000040-GPOS-00018, SRG-OS-000041-GPOS-00019, SRG-OS-000042-GPOS-00020, SRG-OS-000042-GPOS-00021, SRG-OS-000051-GPOS-00024, SRG-OS-000054-GPOS-00025, SRG-OS-000062-GPOS-00031, SRG-OS-000122-GPOS-00063, SRG-OS-000337-GPOS-00129, SRG-OS-000348-GPOS-00136, SRG-OS-000349-GPOS-00137, SRG-OS-000350-GPOS-00138, SRG-OS-000351-GPOS-00139, SRG-OS-000352-GPOS-00140, SRG-OS-000365-GPOS-00152, SRG-OS-000392-GPOS-00172, SRG-OS-000475-GPOS-00220",None,SV-219225r853377_rule,F-20949r305004_fix,"Configure the audit service to produce audit records containing the information needed to establish when (date and time) an event occurred.

Install the audit service (if the audit service is not already installed) with the following command:

# sudo apt-get install auditd

Enable the audit service with the following command:

# sudo systemctl enable auditd.service

In order to reload the rules file, issue the following command:

# sudo augenrules --load",C-20950r305003_chk,"Verify the audit service is configured to produce audit records. 

Check that the audit service is installed properly with the following command:

# dpkg -l | grep auditd

If the ""auditd"" package is not installed, this is a finding.

Check that the audit service is enabled with the following command:

# systemctl is-enabled auditd.service

If the command above returns ""disabled"", this is a finding.

Check that the audit service is properly running and active on the system with the following command:

# systemctl is-active auditd.service
active

If the command above returns ""inactive"", this is a finding."
V-219224,medium,"The Ubuntu operating system must generate audit records for all account creations, modifications, disabling, and termination events that affect /etc/security/opasswd.","Without generating audit records that are specific to the security and mission needs of the organization, it would be difficult to establish, correlate, and investigate the events relating to an incident or identify those responsible for one.

Audit records can be generated from various components within the information system (e.g., module or policy filter).

Satisfies: SRG-OS-000476-GPOS-00221, SRG-OS-000463-GPOS-00207, SRG-OS-000458-GPOS-00203, SRG-OS-000303-GPOS-00120, SRG-OS-000241-GPOS-00091, SRG-OS-000240-GPOS-00090, SRG-OS-000239-GPOS-00089",None,SV-219224r853376_rule,F-20948r305001_fix,"Configure the Ubuntu operating system to generate audit records for all account creations, modifications, disabling, and termination events that affect /etc/security/opasswd.

Add or update the following rule to ""/etc/audit/rules.d/stig.rules"":

-w /etc/security/opasswd -p wa -k usergroup_modification

Note:
The ""root"" account must be used to view/edit any files in the /etc/audit/rules.d/ directory.

In order to reload the rules file, issue the following command:

# sudo augenrules --load",C-20949r305000_chk,"Verify the Ubuntu operating system generates audit records for all account creations, modifications, disabling, and termination events that affect /etc/security/opasswd.

Check the currently configured audit rules with the following command:

# sudo auditctl -l | grep opasswd

-w /etc/security/opasswd -p wa -k usergroup_modification

If the command does not return a line that matches the example or the line is commented out, this is a finding.

Note: The '-k' allows for specifying an arbitrary identifier and the string after it does not need to match the example output above."
V-219223,medium,"The Ubuntu operating system must generate audit records for all account creations, modifications, disabling, and termination events that affect /etc/shadow.","Without generating audit records that are specific to the security and mission needs of the organization, it would be difficult to establish, correlate, and investigate the events relating to an incident or identify those responsible for one.

Audit records can be generated from various components within the information system (e.g., module or policy filter).

Satisfies: SRG-OS-000476-GPOS-00221, SRG-OS-000463-GPOS-00207, SRG-OS-000458-GPOS-00203, SRG-OS-000303-GPOS-00120, SRG-OS-000241-GPOS-00091, SRG-OS-000240-GPOS-00090, SRG-OS-000239-GPOS-00089",None,SV-219223r853375_rule,F-20947r304998_fix,"Configure the Ubuntu operating system to generate audit records for all account creations, modifications, disabling, and termination events that affect /etc/shadow.

Add or update the following rule to ""/etc/audit/rules.d/stig.rules"":

-w /etc/shadow -p wa -k usergroup_modification

Note:
The ""root"" account must be used to view/edit any files in the /etc/audit/rules.d/ directory.

In order to reload the rules file, issue the following command:

# sudo augenrules --load",C-20948r304997_chk,"Verify the Ubuntu operating system generates audit records for all account creations, modifications, disabling, and termination events that affect /etc/shadow.

Check the currently configured audit rules with the following command:

# sudo auditctl -l | grep shadow

-w /etc/shadow -p wa -k usergroup_modification

If the command does not return a line that matches the example or the line is commented out, this is a finding.

Note: The '-k' allows for specifying an arbitrary identifier and the string after it does not need to match the example output above."
V-219222,medium,"The Ubuntu operating system must generate audit records for all account creations, modifications, disabling, and termination events that affect /etc/gshadow.","Without generating audit records that are specific to the security and mission needs of the organization, it would be difficult to establish, correlate, and investigate the events relating to an incident or identify those responsible for one.

Audit records can be generated from various components within the information system (e.g., module or policy filter).

Satisfies: SRG-OS-000476-GPOS-00221, SRG-OS-000463-GPOS-00207, SRG-OS-000458-GPOS-00203, SRG-OS-000303-GPOS-00120, SRG-OS-000241-GPOS-00091, SRG-OS-000240-GPOS-00090, SRG-OS-000239-GPOS-00089",None,SV-219222r853374_rule,F-20946r304995_fix,"Configure the Ubuntu operating system to generate audit records for all account creations, modifications, disabling, and termination events that affect /etc/gshadow.

Add or update the following rule to ""/etc/audit/rules.d/stig.rules"":

-w /etc/gshadow -p wa -k usergroup_modification

Note:
The ""root"" account must be used to view/edit any files in the /etc/audit/rules.d/ directory.

In order to reload the rules file, issue the following command:

# sudo augenrules --load",C-20947r304994_chk,"Verify the Ubuntu operating system generates audit records for all account creations, modifications, disabling, and termination events that affect /etc/gshadow.

Check the currently configured audit rules with the following command:

# sudo auditctl -l | grep gshadow

-w /etc/gshadow -p wa -k usergroup_modification

If the command does not return a line that matches the example or the line is commented out, this is a finding.

Note: The '-k' allows for specifying an arbitrary identifier and the string after it does not need to match the example output above."
V-219221,medium,"The Ubuntu operating system must generate audit records for all account creations, modifications, disabling, and termination events that affect /etc/group.","Without generating audit records that are specific to the security and mission needs of the organization, it would be difficult to establish, correlate, and investigate the events relating to an incident or identify those responsible for one.

Audit records can be generated from various components within the information system (e.g., module or policy filter).

Satisfies: SRG-OS-000476-GPOS-00221, SRG-OS-000239-GPOS-00089, SRG-OS-000240-GPOS-00090, SRG-OS-000241-GPOS-00091, SRG-OS-000303-GPOS-00120, SRG-OS-000458-GPOS-00203, SRG-OS-000463-GPOS-00207",None,SV-219221r853373_rule,F-20945r304992_fix,"Configure the Ubuntu operating system to generate audit records for all account creations, modifications, disabling, and termination events that affect /etc/group.

Add or update the following rule to ""/etc/audit/rules.d/stig.rules"":

-w /etc/group -p wa -k usergroup_modification

Note:
The ""root"" account must be used to view/edit any files in the /etc/audit/rules.d/ directory.

In order to reload the rules file, issue the following command:

# sudo augenrules --load",C-20946r304991_chk,"Verify the Ubuntu operating system generates audit records for all account creations, modifications, disabling, and termination events that affect /etc/group.

Check the currently configured audit rules with the following command:

# sudo auditctl -l | grep group

-w /etc/group -p wa -k usergroup_modification

If the command does not return a line that matches the example or the line is commented out, this is a finding.

Note: The '-k' allows for specifying an arbitrary identifier and the string after it does not need to match the example output above."
V-219220,medium,"The Ubuntu operating system must generate audit records for all account creations, modifications, disabling, and termination events that affect /etc/passwd.","Without generating audit records that are specific to the security and mission needs of the organization, it would be difficult to establish, correlate, and investigate the events relating to an incident or identify those responsible for one.

Audit records can be generated from various components within the information system (e.g., module or policy filter).

Satisfies: SRG-OS-000476-GPOS-00221, SRG-OS-000239-GPOS-00089, SRG-OS-000240-GPOS-00090, SRG-OS-000241-GPOS-00091, SRG-OS-000303-GPOS-00120, SRG-OS-000458-GPOS-00203, SRG-OS-000463-GPOS-00207, SRG-OS-000004-GPOS-00004",None,SV-219220r853372_rule,F-20944r304989_fix,"Configure the Ubuntu operating system to generate audit records for all account creations, modifications, disabling, and termination events that affect /etc/passwd.

Add or update the following rule to ""/etc/audit/rules.d/stig.rules"":

-w /etc/passwd -p wa -k usergroup_modification

Note:
The ""root"" account must be used to view/edit any files in the /etc/audit/rules.d/ directory.

In order to reload the rules file, issue the following command:

# sudo augenrules --load",C-20945r304988_chk,"Verify the Ubuntu operating system generates audit records for all account creations, modifications, disabling, and termination events that affect /etc/passwd.

Check the currently configured audit rules with the following command:

# sudo auditctl -l | grep passwd

-w /etc/passwd -p wa -k usergroup_modification

If the command does not return a line that matches the example or the line is commented out, this is a finding.

Note: The '-k' allows for specifying an arbitrary identifier and the string after it does not need to match the example output above."
